{
  "schemaVersion": "memorylineage-recovery-receipt-v2",
  "decisionId": "0xeba538142f462a96b047fa734b62056a0ac1e7e67546a3a2a23e2a8cf1448e74",
  "policyId": "strict-authorized-current-head-v2",
  "candidate": {
    "snapshotProfile": "memorylineage/private-snapshot/v2",
    "candidateCommitment": "0x17069cac5b96a074dc1f3efc8aec5c094bb6ac6acdfd73d071388f66b383aef7",
    "snapshotSequence": 3
  },
  "evidence": {
    "sourceClass": "DEMO_SPACE_V2_LOCAL",
    "bundleHash": "0x71e10debf9fe8b64abdc6898be3689997d4dbbdd2a1bb5f12163e5b5134406ba",
    "specSnapshot": "v1-pinned-vector-2026-09-18",
    "registryAddress": "0xcf23e7ac4477f4d7b93fea8512afbc21f532dcc6",
    "spaceId": "0x40159f0b27e609581b93930346027cc977b6717ee53c7ccf725c35105d162cb1",
    "head": {
      "transitionId": "0xe5d1b78582ec2a2810ba95311e5b9fef20d10cd32a95744ec6611e983c5fe145",
      "stateRoot": "0xa89ff09763ac4e0bf4e62c14ba128396114ea94b023f4abaf4b412fd0666f2f0",
      "sequence": 3
    },
    "blockContext": null
  },
  "decision": {
    "classification": "CURRENT_HEAD",
    "reasonCode": "CANDIDATE_MATCHES_EVIDENCE_HEAD",
    "recommendedAction": "RESUME_ALLOWED"
  },
  "assurance": {
    "lineageReplay": "VERIFIED",
    "authorityHistory": "TIMELINE_BOUND",
    "transitionAuthorization": "EOA_SIGNATURES_VERIFIED",
    "source": "DEMO_SPACE_V2_LOCAL"
  },
  "limitations": [
    "does_not_assess_semantic_truth",
    "does_not_prove_off_chain_availability",
    "does_not_claim_runtime_enforcement"
  ]
}
